{
  "schema_version": "2.0.0",
  "artifact_set_id": "aaaaaaaa-aaaa-4aaa-8aaa-aaaaaaaaaaaa",
  "artifact_set_version": 1,
  "project_id": "bbbbbbbb-bbbb-4bbb-8bbb-bbbbbbbbbbbb",
  "attempt_id": "cccccccc-cccc-4ccc-8ccc-cccccccccccc",
  "producer": {
    "component": "georeferencing",
    "version": "0.1.0",
    "execution_id": "exec-001"
  },
  "created_at": "2026-07-27T00:00:00Z",
  "inputs": [
    {
      "artifact_id": "99999999-9999-4999-8999-999999999999",
      "sha256": "bbbbbbbbbbbbbbbbbbbbbbbbbbbbbbbbbbbbbbbbbbbbbbbbbbbbbbbbbbbbbbbb"
    }
  ],
  "artifacts": [
    {
      "artifact_id": "88888888-8888-4888-8888-888888888888",
      "artifact_kind": "COG_RASTER",
      "logical_name": "georeferenced-primary",
      "relative_path": "results/attempt-1/georeferenced.tif",
      "media_type": "image/tiff; application=geotiff; profile=cloud-optimized",
      "size_bytes": 1048576,
      "sha256": "aaaaaaaaaaaaaaaaaaaaaaaaaaaaaaaaaaaaaaaaaaaaaaaaaaaaaaaaaaaaaaaa",
      "role": "PRIMARY",
      "validation_profile_id": "AVP-COG-1",
      "created_at": "2026-07-27T00:00:00Z",
      "geospatial": {
        "crs": "EPSG:31983",
        "bbox": [
          500000.0,
          7000000.0,
          501000.0,
          7001000.0
        ],
        "shape": [
          1000,
          1000
        ],
        "resolution": [
          1.0,
          1.0
        ],
        "nodata": 0,
        "pixel_is_area": true,
        "bands": [
          {
            "index": 1,
            "data_type": "uint16"
          }
        ]
      },
      "lineage_inputs": [
        "99999999-9999-4999-8999-999999999999"
      ],
      "properties": {
        "compression": "DEFLATE",
        "overviews": [
          2,
          4,
          8,
          16
        ]
      }
    }
  ],
  "lineage": {
    "processing_plan_id": "plan-001",
    "software_bill": [
      {
        "name": "gdal",
        "version": "3.13"
      }
    ],
    "parent_artifact_set_ids": []
  },
  "publication": {
    "status": "PUBLISHED",
    "staging_id": "staging-001",
    "published_at": "2026-07-27T00:00:00Z",
    "publication_record_id": "dddddddd-dddd-4ddd-8ddd-dddddddddddd"
  },
  "root_digest": "cccccccccccccccccccccccccccccccccccccccccccccccccccccccccccccccc"
}
